Name,Age,Gender/Pronouns,Role in Group,Occupation,Industry,Household Income,Education,Location Type,Marital Status,Children,Tech Savviness (1-10),Primary Social Platforms,Values,Interests & Hobbies,Pain Points,Motivations,Gaming/Play Style,Decision Making Style,Brand Affinities,Preferred Communication,Characteristic Quote,What They Want from Game Night,Likely to Sign Up for Email,Conversion Triggers,Marketing Notes
Sofia Hernandez,38,Female/She/Her,The Organizer,Marketing Director,Tech/SaaS,185000,MBA,Suburban,Married,2 (Maya 14 and Eli 10),8,"Instagram, LinkedIn, Pinterest","Achievement, Family Connection, Being Prepared","Running, meal planning, podcasts, home organization, wine",Too many things competing for family time; kids are on screens constantly; hard to get everyone engaged together,Wants to create memorable family moments; prove she can balance career and family life; stay connected to kids as they get older,Competitive but hides it; wants clear rules and structure; researches before committing,Thorough researcher; reads reviews; asks friends; needs social proof,"Apple, Athleta, Crate & Barrel, Peloton, Headspace",Email newsletters and curated recommendations,"""Okay but what are the ACTUAL rules?""",Structured fun that brings everyone together; something she can facilitate successfully,Very Likely - will sign up immediately,Quality design; clear value proposition; anything that helps her be the 'fun parent',Primary target persona. She's the one who will find the site and share it. Appeal to her desire to create connection. She'll sign up and forward to the group.
Marcus Chen,41,Male/He/Him,The Dad Joke Engine,Senior Software Engineer,Technology,210000 (combined with Sofia),MS Computer Science,Suburban,Married,2 (Maya 14 and Eli 10),9,"Reddit, YouTube, LinkedIn, Hacker News","Humor, Intellectual Curiosity, Quality Time","Board games, sci-fi, woodworking, cooking, fantasy football",Work stress; feeling disconnected from teenage daughter; activities that feel forced,Wants genuine laughs and connection; enjoys being the comic relief; values low-pressure bonding,More interested in entertainment than winning; will derail games for a good joke; patient with chaos,Analytical but not rigid; appreciates clever design; will try things if spouse suggests,"Nintendo, Patagonia, Instant Pot, local craft breweries",Text messages and word-of-mouth,"""Wait wait — hear me out...""",Permission to be silly; genuine laughs; seeing his kids have fun,Likely - will use it if Sofia sets it up,Clever writing; dad joke energy; anything he can riff on,Secondary persona. Won't find the site himself but will become an enthusiast. The prompts' humor will resonate with him. He'll become a repeat user.
Devin Murphy,36,Non-binary/They/Them,The Chaos Agent,Hotel General Manager,Hospitality,95000,BA Communications,Urban adjacent,Married,1 (Juni 8),7,"TikTok, Instagram, Twitter/X","Spontaneity, Inclusion, Experiences Over Things","Drag shows, karaoke, travel, cooking experiments, thrifting",Structured activities feel boring; hard to find games that work for mixed ages; hates waiting for their turn,Wants memorable moments and stories to tell later; enjoys pushing boundaries; loves when things go sideways,Maximum chaos; will find loopholes; wants games that allow creativity and interpretation,Impulse-driven; responds to novelty and humor; shares things that make them laugh,"Glossier, Away luggage, local queer-owned businesses, Nintendo Switch",Social media DMs and group texts,"""Okay but what if we made it INTERESTING?""",Unexpected moments; permission to be weird; games that don't take themselves seriously,Very Likely - will screenshot and share,Anything irreverent; 'After Dark' adult versions; shareable moments,High-value persona for virality. They'll share the adult games on social media. Target with the edgier content. They're the word-of-mouth amplifier.
Rachel Murphy,39,Female/She/Her,The Reluctant Player,High School Art Teacher,Education,68000,MFA Studio Art,Urban adjacent,Married,1 (Juni 8),5,"Pinterest, Instagram (rarely posts)","Creativity, Authenticity, Meaningful Connection","Painting, gardening, pottery, reading literary fiction, yoga",Social exhaustion; forced fun feels draining; competitive environments stress her out,Wants genuine creative expression; enjoys observing before participating; values depth over breadth,Slow to engage but becomes secretly invested; excels at creative/artistic challenges; quietly competitive,Cautious; influenced by trusted friends; needs to see others enjoying something first,"Anthropologie, local bookstores, Etsy, museums",In-person conversations and thoughtful emails,"""Fine ONE round."" (plays six rounds)",Low-pressure creativity; watching others have fun; being pleasantly surprised by her own competitiveness,Somewhat Likely - needs social proof first,Creative games highlighted; testimonials; seeing her spouse excited about it,Represents the 'reluctant gamer' segment. She won't seek this out but will become a fan. Sketch the Unsketachable is her jam. Show testimonials from similar personas.
Terrence Washington,44,Male/He/Him,The Newcomer,High School History Teacher,Education,72000,MA History,Urban,Divorced (recently),0 (shares custody of twins 12 who aren't at this gathering),6,"Facebook, YouTube, ESPN app","Fairness, Self-Improvement, New Experiences","History documentaries, running, trying new restaurants, community theater",Social anxiety in new groups; dating scene is exhausting; not sure how to have fun as a single adult,Wants to expand social circle; prove he can still be fun; find activities that help him connect,By-the-book initially; loosens up after one round; surprisingly good sport about losing,Careful at first then increasingly spontaneous; responds to welcoming energy,"NPR, local sports teams, REI, classic brands (Brooks Brothers, J.Crew)",Email and Facebook events,"""Is that... allowed?""",Low-stakes way to connect with new people; clear rules so he doesn't embarrass himself; feeling included,Likely - will save link for later use,Anything positioned as 'easy to jump into'; social/party angle; testimonials about connecting with friends,Represents the 'trying to build social life' segment. Position as a way to be the person who brings fun to gatherings. He'll use this to host his own game nights.
Maya Chen-Hernandez,14,Female/She/Her,The Eye-Roller,8th Grade Student,N/A,N/A (parents' household),Middle School,Suburban,N/A (minor),N/A,9,"TikTok, Instagram, BeReal, Discord","Independence, Authenticity, Being Taken Seriously","K-pop, digital art, volleyball, anime, group chats with friends",Adults trying too hard; being treated like a little kid; activities that feel cringe,Wants to feel mature; secretly enjoys family time but won't admit it; loves winning against adults,Acts disengaged; actually hyper-competitive; quick thinker; will destroy adults without mercy,Peer-influenced; responds to things that feel current and not try-hard,Whatever is trending on TikTok; Glossier; Stanley cups; anything her friends like,Group chats and TikTok comments,"""*audible sigh* FINE.""",Feeling like she's being treated as an equal; opportunities to beat adults; something not embarrassing to mention to friends,Unlikely directly - but influences parents,Would share if it felt 'cool' not 'family activity'; needs peer validation first,Not a direct conversion target but hugely influential. If Maya thinks it's lame her parents won't use it. The prompts need to be genuinely funny not 'family friendly funny.' She's the vibe check.
Eli Chen-Hernandez,10,Male/He/Him,The Rule Lawyer,5th Grade Student,N/A,N/A (parents' household),Elementary School,Suburban,N/A (minor),N/A,7,"YouTube, Roblox, Minecraft","Fairness, Mastery, Being Right","Pokémon, Minecraft, chess club, comic books, LEGO",When people don't follow rules; being dismissed because he's young; cheaters,Wants to be seen as smart and capable; enjoys mastering systems; takes pride in expertise,Fair play absolutist; studies rules before playing; strategic thinker; will call out violations,Systematic; wants to understand how things work before starting,Pokémon; LEGO; Marvel; Nintendo; anything with collectible elements,Face-to-face explanation of rules,"""Actually that's not how it works.""",Clear rules he can master; being the expert; fair competition,N/A (minor - not target for email),Parents would note if he's engaged and having fun,Not a conversion target but his engagement matters. If he's bored or frustrated the parents will stop. Games need clear consistent rules. Missing Link and Crime Scene Chaos will appeal to his puzzle-brain.
Juniper 'Juni' Murphy,8,Female/She/Her,The Wild Card,3rd Grade Student,N/A,N/A (parents' household),Elementary School,Urban adjacent,N/A (minor),N/A,5,"YouTube Kids, Roblox (supervised)","Fun, Belonging, Being Included","Art projects, gymnastics, her stuffed animal collection, making up stories, dancing",Being left out of adult activities; games that are too complicated; waiting too long for her turn,Wants to be included with the big kids; loves attention; enjoys creative chaos,Unpredictable; short attention span; answers are either genius or nonsense; will change teams mid-game,In the moment; follows energy and enthusiasm; gravitates toward whoever is having most fun,Disney; anything sparkly; LOL Surprise; Bluey; whatever Maya likes (but don't tell Maya),Verbal explanation with enthusiasm,"""WAIT I HAVE AN IDEA!""",Being included; not having to wait too long; creative expression; snacks,N/A (minor - not target for email),Parents will return if kids stay engaged,Not a conversion target but the canary in the coal mine. If Juni is melting down the game night ends. Prompts need to move quickly and have creative elements that let wild answers shine. Her chaos should be feature not bug.
